[
  {
    "configFields": [
      {
        "key": "fileName",
        "labelKey": "components.exports.csv.fileName",
        "required": true,
        "secret": false,
        "type": "text"
      }
    ],
    "descriptionKey": "components.exports.csv.description",
    "displayNameKey": "components.exports.csv.name",
    "inputFamilies": [
      "tabular"
    ],
    "kind": "export",
    "outputFamilies": [],
    "type": "export.csv",
    "version": "v1"
  },
  {
    "configFields": [
      {
        "key": "fileName",
        "labelKey": "components.exports.json.fileName",
        "required": true,
        "secret": false,
        "type": "text"
      }
    ],
    "descriptionKey": "components.exports.json.description",
    "displayNameKey": "components.exports.json.name",
    "inputFamilies": [
      "tabular"
    ],
    "kind": "export",
    "outputFamilies": [],
    "type": "export.json",
    "version": "v1"
  },
  {
    "configFields": [
      {
        "key": "fileName",
        "labelKey": "components.exports.parquet.fileName",
        "required": true,
        "secret": false,
        "type": "text"
      }
    ],
    "descriptionKey": "components.exports.parquet.description",
    "displayNameKey": "components.exports.parquet.name",
    "inputFamilies": [
      "tabular"
    ],
    "kind": "export",
    "outputFamilies": [],
    "type": "export.parquet",
    "version": "v1"
  },
  {
    "configFields": [
      {
        "key": "targetTable",
        "labelKey": "components.exports.postgres.targetTable",
        "required": true,
        "secret": false,
        "type": "text"
      },
      {
        "key": "writeMode",
        "labelKey": "components.exports.postgres.writeMode",
        "options": [
          {
            "labelKey": "components.exports.postgres.writeMode.replace",
            "value": "replace"
          },
          {
            "labelKey": "components.exports.postgres.writeMode.append",
            "value": "append"
          }
        ],
        "required": false,
        "secret": false,
        "type": "select"
      },
      {
        "key": "connectionUrl",
        "labelKey": "components.exports.postgres.connectionUrl",
        "required": true,
        "secret": true,
        "type": "text"
      }
    ],
    "descriptionKey": "components.exports.postgres.description",
    "displayNameKey": "components.exports.postgres.name",
    "inputFamilies": [
      "tabular"
    ],
    "kind": "export",
    "outputFamilies": [],
    "type": "export.postgres",
    "version": "v1"
  },
  {
    "configFields": [
      {
        "key": "sourcePath",
        "labelKey": "components.sources.csv.sourcePath",
        "required": true,
        "secret": false,
        "type": "text"
      },
      {
        "key": "hasHeader",
        "labelKey": "components.sources.csv.hasHeader",
        "required": false,
        "secret": false,
        "type": "boolean"
      },
      {
        "key": "separator",
        "labelKey": "components.sources.csv.separator",
        "required": false,
        "secret": false,
        "type": "text"
      }
    ],
    "descriptionKey": "components.sources.csv.description",
    "displayNameKey": "components.sources.csv.name",
    "inputFamilies": [],
    "kind": "source",
    "outputFamilies": [
      "tabular"
    ],
    "type": "source.csv",
    "version": "v1"
  },
  {
    "configFields": [
      {
        "key": "sourcePath",
        "labelKey": "components.sources.json.sourcePath",
        "required": true,
        "secret": false,
        "type": "text"
      }
    ],
    "descriptionKey": "components.sources.json.description",
    "displayNameKey": "components.sources.json.name",
    "inputFamilies": [],
    "kind": "source",
    "outputFamilies": [
      "document"
    ],
    "type": "source.json",
    "version": "v1"
  },
  {
    "configFields": [
      {
        "key": "connectionUrl",
        "labelKey": "components.sources.postgres.connectionUrl",
        "required": true,
        "secret": true,
        "type": "text"
      },
      {
        "key": "table",
        "labelKey": "components.sources.postgres.table",
        "required": false,
        "secret": false,
        "type": "text"
      },
      {
        "key": "query",
        "labelKey": "components.sources.postgres.query",
        "required": false,
        "secret": false,
        "type": "textarea"
      },
      {
        "key": "chunkSize",
        "labelKey": "components.sources.postgres.chunkSize",
        "required": false,
        "secret": false,
        "type": "number"
      },
      {
        "key": "checkpointColumn",
        "labelKey": "components.sources.postgres.checkpointColumn",
        "required": false,
        "secret": false,
        "type": "text"
      }
    ],
    "descriptionKey": "components.sources.postgres.description",
    "displayNameKey": "components.sources.postgres.name",
    "inputFamilies": [],
    "kind": "source",
    "outputFamilies": [
      "tabular"
    ],
    "type": "source.postgres",
    "version": "v1"
  },
  {
    "configFields": [
      {
        "key": "url",
        "labelKey": "components.sources.rest.url",
        "required": true,
        "secret": false,
        "type": "text"
      },
      {
        "key": "path",
        "labelKey": "components.sources.rest.path",
        "required": false,
        "secret": false,
        "type": "text"
      },
      {
        "key": "queryParams",
        "labelKey": "components.sources.rest.queryParams",
        "required": false,
        "secret": false,
        "type": "json"
      },
      {
        "key": "headers",
        "labelKey": "components.sources.rest.headers",
        "required": false,
        "secret": false,
        "type": "json"
      },
      {
        "key": "apiToken",
        "labelKey": "components.sources.rest.apiToken",
        "required": false,
        "secret": true,
        "type": "text"
      },
      {
        "key": "authHeader",
        "labelKey": "components.sources.rest.authHeader",
        "required": false,
        "secret": false,
        "type": "text"
      },
      {
        "key": "authScheme",
        "labelKey": "components.sources.rest.authScheme",
        "required": false,
        "secret": false,
        "type": "text"
      },
      {
        "key": "nextPagePath",
        "labelKey": "components.sources.rest.nextPagePath",
        "required": false,
        "secret": false,
        "type": "text"
      },
      {
        "key": "pageParameter",
        "labelKey": "components.sources.rest.pageParameter",
        "required": false,
        "secret": false,
        "type": "text"
      },
      {
        "key": "checkpointPath",
        "labelKey": "components.sources.rest.checkpointPath",
        "required": false,
        "secret": false,
        "type": "text"
      },
      {
        "key": "checkpointParameter",
        "labelKey": "components.sources.rest.checkpointParameter",
        "required": false,
        "secret": false,
        "type": "text"
      },
      {
        "key": "maxPages",
        "labelKey": "components.sources.rest.maxPages",
        "required": false,
        "secret": false,
        "type": "number"
      }
    ],
    "descriptionKey": "components.sources.rest.description",
    "displayNameKey": "components.sources.rest.name",
    "inputFamilies": [],
    "kind": "source",
    "outputFamilies": [
      "document"
    ],
    "type": "source.rest",
    "version": "v1"
  },
  {
    "configFields": [
      {
        "key": "sourcePath",
        "labelKey": "components.sources.xlsx.sourcePath",
        "required": true,
        "secret": false,
        "type": "text"
      },
      {
        "key": "sheetName",
        "labelKey": "components.sources.xlsx.sheetName",
        "required": false,
        "secret": false,
        "type": "text"
      },
      {
        "key": "hasHeader",
        "labelKey": "components.sources.xlsx.hasHeader",
        "required": false,
        "secret": false,
        "type": "boolean"
      }
    ],
    "descriptionKey": "components.sources.xlsx.description",
    "displayNameKey": "components.sources.xlsx.name",
    "inputFamilies": [],
    "kind": "source",
    "outputFamilies": [
      "tabular"
    ],
    "type": "source.xlsx",
    "version": "v1"
  },
  {
    "configFields": [
      {
        "key": "columns",
        "labelKey": "components.transforms.columns.drop.columns",
        "required": true,
        "secret": false,
        "type": "json"
      }
    ],
    "descriptionKey": "components.transforms.columns.drop.description",
    "displayNameKey": "components.transforms.columns.drop.name",
    "inputFamilies": [
      "tabular"
    ],
    "kind": "transform",
    "outputFamilies": [
      "tabular"
    ],
    "type": "transform.columns.drop",
    "version": "v1"
  },
  {
    "configFields": [
      {
        "key": "renames",
        "labelKey": "components.transforms.columns.rename.renames",
        "required": true,
        "secret": false,
        "type": "json"
      }
    ],
    "descriptionKey": "components.transforms.columns.rename.description",
    "displayNameKey": "components.transforms.columns.rename.name",
    "inputFamilies": [
      "tabular"
    ],
    "kind": "transform",
    "outputFamilies": [
      "tabular"
    ],
    "type": "transform.columns.rename",
    "version": "v1"
  },
  {
    "configFields": [
      {
        "key": "columns",
        "labelKey": "components.transforms.columns.reorder.columns",
        "required": true,
        "secret": false,
        "type": "json"
      }
    ],
    "descriptionKey": "components.transforms.columns.reorder.description",
    "displayNameKey": "components.transforms.columns.reorder.name",
    "inputFamilies": [
      "tabular"
    ],
    "kind": "transform",
    "outputFamilies": [
      "tabular"
    ],
    "type": "transform.columns.reorder",
    "version": "v1"
  },
  {
    "configFields": [
      {